,Age,Condition,Date,Drug,DrugId,EaseofUse,Effectiveness,Reviews,Satisfaction,Sex,Sides,UsefulCount
354868,45-54,Convulsive Seizures,3/3/2013,carbamazepine,1493,5,5,I preveously was taking Dilantin 100mg and I am currently taking carbamezapine 200mg 3 in the am 3 in the pm. I swear by this  medication for over 30 yeara now and have not had any seizures  ,5,Male,"Nausea ,  vomiting ,  dizziness , drowsiness,  constipation ,  dry mouth , or unsteadiness may occur.",0
354869,35-44,Convulsive Seizures,2/21/2013,carbamazepine,1493,3,3, ,3,Male,"Nausea ,  vomiting ,  dizziness , drowsiness,  constipation ,  dry mouth , or unsteadiness may occur.",0
354883,65-74,Facial Nerve Pain,1/20/2013,carbamazepine,1493,3,3, ,3,Male,"Nausea ,  vomiting ,  dizziness , drowsiness,  constipation ,  dry mouth , or unsteadiness may occur.",4
354884,55-64,Facial Nerve Pain,1/20/2013,carbamazepine,1493,5,5,"carbamazepine Oral / Tegretol

It is also used to relieve one type of nerve pain (trigeminal neuralgia). 
Mine was located just under my molar on the left side of my face.
Ironically, I had just had a dental procedure done to the lower molar on that side of my mouth.
I repeatedly went to my dentist to have the severe pain corrected.
He could find nothing wrong, but gave me Vicodan to relieve the pain.
At first, the Vicodan worked. After 10 to 20 minutes the pain disappeared like the snap of my fingers. I can descibe it no other way.
It worked for a for about 3 hours before the pain returned.
It was not very long, maybe 4 days or so before it stopped working and I had that intense pain again.
I kept adding pain relievers to the vicidan...tylenol, asperin, alieve etc.
Nothing worked.
At one point I took the Vicidan, 3 tablets, 3 asperin, alieve and some percoset given to me by a co-worker all within an hour.
I know that this was dangerous and very very stupid.
However, even this excessive dose did NOTHING for the pain.
I finally went to my doctor and within seconds of explaining the pain and location he prescribed this medicine.
I only had to take 200 mg, for one or two days and my condition ended.

To me this is a miracle drug and thank the Lord for a miracle doctor.
I realize that this medicine is proscribed for many conditions and may not work for all of them, but for my particular condition, it was a Godsend.",5,Male,"Nausea ,  vomiting ,  dizziness , drowsiness,  constipation ,  dry mouth , or unsteadiness may occur.",16
354896,35-44,Nerve Pain,1/16/2013,carbamazepine,1493,4,3,"I am very out of it on this drug.  I've only been on it 2 days, taking half a pill at bedtime.  I wake up completed zoo-ed, doped, stoned, very unco-ordinated, weak, dull, i have tingly lips, cant stop squinting, slight headache, not hungry, trouble showing emotion and following conversations.  
I'd like to discontinue this drug.  I can completely see why it would be effective for  ADDH as i am quite lethargic and dazed.  Right now i have to go into a meeting at work but i would be more than happy just sitting staring at a wall for the rest of the day.  I feel completely robbed of emotion, feeling, and personality.

",2,Female,"Nausea ,  vomiting ,  dizziness , drowsiness,  constipation ,  dry mouth , or unsteadiness may occur.",0
354904,35-44,Facial Nerve Pain,1/16/2013,carbamazepine,1493,4,3,"I have only been taking this med for 2 days. My lips have been all tingly since, and i am in a complete fog.  For some reason i am squinting alot, even in dimly lit rooms, and i feel very weak and unco-ordinated.  Im only taking half a pill right now before bedtime.  I sleep pretty good, but wake up feeling very out of it and almost stoned.  right now it's been 12 hours since i took my 2nd dose and i am in a complete daze and very out of it.
Yesterday the facial pain was lessened, but the pain around the side/back of my head was still constant.  
The numbness in my lips is annoying, but i can live with that if i could just WAKE UP and shake this drugged out feeling.  Conversations are an effort.....I'd just like to go back to bed.",2,Female,"Nausea ,  vomiting ,  dizziness , drowsiness,  constipation ,  dry mouth , or unsteadiness may occur.",11
354905,65-74,Epileptic Seizure,12/21/2012,carbamazepine,1493,5,5,"I HAVE TAKEN FOR 14 YEARS AND FOUND IT TO BE VERY EFFECTIVE UNTIL RECENTLY.  ABOUT 90 DAYS AGO, I STARTED DRINKING SOME HEAVY BLOODY MARY'S AND THIS ACTIVITY SEEMED TO COMPLETELY BLOCK THE EFFECTVENESS OF THE DRUG AND AFTER 14 YEARS OF NO SEIZURES, I RETURNED TO FAIRLY REGULAR GRAND MALS IN THE SLEEP PERIODS. My neurologists graciosly pointed out to me that I was a grown man but, the continued heavy drinking and resulting Grand Mals were not advised; so, I returned to an occasional glass of Red and the seizure activity stopped.",5,Male,"Nausea ,  vomiting ,  dizziness , drowsiness,  constipation ,  dry mouth , or unsteadiness may occur.",1
354912,35-44,Facial Nerve Pain,12/13/2012,carbamazepine,1493,4,5,"I've been on 100mg twice daily for about a month. It has been effective for the pain relief. I was supposed to increase to 200 mg twice daily after ten days but didn't do it. The down side is it has turned me into a complete dullard. Tired, slow to respond, dropping out of conversations, long nights of sleep and still wake up tired. I'm going to try and taper off and try alternatives if the pain comes back.",2,Male,"Nausea ,  vomiting ,  dizziness , drowsiness,  constipation ,  dry mouth , or unsteadiness may occur.",14
354922,65-74,Facial Nerve Pain,11/28/2012,carbamazepine,1493,5,3,too early to tell,2,Female,"Nausea ,  vomiting ,  dizziness , drowsiness,  constipation ,  dry mouth , or unsteadiness may occur.",3
354923,75 or over,Other,11/15/2012,carbamazepine,1493,3,3,suffered a heart seizure,3,Female,"Nausea ,  vomiting ,  dizziness , drowsiness,  constipation ,  dry mouth , or unsteadiness may occur.",1
354935,35-44,Convulsive Seizures,11/14/2012,carbamazepine,1493,4,3,"The side effects are a bummer (for me hair loss, tiredness, and bone loss in my gums).  Some of the SE came as a surprise as they happened and I was told ""oh by the way your medication is causing this"".  I have taken this medication for about 15 yrs now and it has kept me at about 2-3 seizures a year so I can't complain too much.",3,Female,"Nausea ,  vomiting ,  dizziness , drowsiness,  constipation ,  dry mouth , or unsteadiness may occur.",1
354944,35-44,Other,11/11/2012,carbamazepine,1493,3,1,"I am a friend who tells me he has leukemia and still in a lot a pain ,to check it out on my pc",1,Male,"Nausea ,  vomiting ,  dizziness , drowsiness,  constipation ,  dry mouth , or unsteadiness may occur.",1
354953,19-24,Bipolar I Disorder with Most Recent Episode Mixed,8/9/2012,carbamazepine,1493,5,5,"I have been taking carbamazepine for a few months for my bipolar II and it has been extremely effective.  My only major side effects have been persistent drowsiness (relieved by the addition of a B-50 supplement) and a major decrease in sex drive.

Overall I have been pleased with this drug and have often recommended it to those who have not gotten relief from other prescriptions to discuss with their doctors.",4,Female,"Nausea ,  vomiting ,  dizziness , drowsiness,  constipation ,  dry mouth , or unsteadiness may occur.",5
354963,65-74,Facial Nerve Pain,8/2/2012,carbamazepine,1493,5,5,"have been on 1200mg twice a day for over two yrs. had to add a suplement after 2 yrs and now i ahve had 3 black out experiences all type of test bllod sodium level low at 125 alot . normal is 135 to 145. dr. is now trying same meds with adding lyrica and see if we can lower  the oxcarbapine
",3,Male,"Nausea ,  vomiting ,  dizziness , drowsiness,  constipation ,  dry mouth , or unsteadiness may occur.",5
354974,45-54,Facial Nerve Pain,6/5/2012,carbamazepine,1493,5,5,"The pain was intense while it lasted, but with the Carbamazapine it subsided greatly.  I can tell that it is still there because my teeth and gums are numb to the touch making it difficult to eat.  I have found a tremendous help with a Chiropractor. I am not a big fan, but went in with back pain and told him about TN and he did research and when I had pain, he helped it a lot.  Reduced the swelling and the pain went completely away after a few days.  Make sure you find a Chiropractor that practices the ""Gonstead Method"".  This is very important.  Tell him to research TN with his method and see if he can help.  I have had two bouts and it went away within two days of each.  No meds.  The doctor who diagnosed me is the head of Neuro-Surgery at Duke University.  Dr. Allan Friedman.  He told me to not use the Carbamazapine unless I had pain.  The drug makes me very tired and want to sleep all the time.  I was diagnosed 2-3 years ago.  Let me know if a Chiropractor works for you! ",3,Male,"Nausea ,  vomiting ,  dizziness , drowsiness,  constipation ,  dry mouth , or unsteadiness may occur.",11
354985,55-64,Bipolar Disorder in Remission,5/24/2012,carbamazepine,1493,4,4,"watch for OD effects ie: drowsiness, on Diazepam and codiende.  I was treated for Bipolar and this is my second time on it.",4,Female,"Nausea ,  vomiting ,  dizziness , drowsiness,  constipation ,  dry mouth , or unsteadiness may occur.",4
354992,55-64,Prevention of Seizures following Head Injury or Surgery,4/27/2012,carbamazepine,1493,5,5,great medication for partial temporal lobe seizures.Time release....must take on time every day.,5,Male,"Nausea ,  vomiting ,  dizziness , drowsiness,  constipation ,  dry mouth , or unsteadiness may occur.",0
355000,45-54,Facial Nerve Pain,4/7/2012,carbamazepine,1493,2,4,"It is hard for me to take at the  same time every day. And it has a bad after taste, and you have too eat when you take it also.",3,Female,"Nausea ,  vomiting ,  dizziness , drowsiness,  constipation ,  dry mouth , or unsteadiness may occur.",4
355009,45-54,Facial Nerve Pain,1/22/2012,carbamazepine,1493,4,2,"Intense chronic pain related to TN. Taking this med along with 30 mg Oxycodone. Pain is most always present. This med has left me confused, effected recall & caused dizziness w/loss of coordination. The ineffectiveness of availale meds is quite disheartening. ",1, ,"Nausea ,  vomiting ,  dizziness , drowsiness,  constipation ,  dry mouth , or unsteadiness may occur.",6
355010, ,Epileptic Seizure,1/13/2012,carbamazepine,1493,5,5,"I have been using this medication (first Tegretol, more recently the generic Carbamazepine) for more than 20 years. It has controled my seizures perfectly and, after an initial adjustment period, has very few minor side effects. ",5,Female,"Nausea ,  vomiting ,  dizziness , drowsiness,  constipation ,  dry mouth , or unsteadiness may occur.",2
355022,45-54,Other,12/5/2011,carbamazepine,1493,4,3,"prescribed for cluster headaches.  Reduced the intensity of the headaches but I still get them.  The side effects are pretty severe, heart punding, unsteadiness, diziness.  I am weaning off of them now and won't take them again.",1,Male,"Nausea ,  vomiting ,  dizziness , drowsiness,  constipation ,  dry mouth , or unsteadiness may occur.",1
355030, ,Epileptic Seizure,9/14/2011,carbamazepine,1493,4,5,"Switched to Tegretol (brand name of carbamazepine) after a four and a half months on Keppra as it was no longer working and caused severe emotional issues. Switchover was a bit difficult-dizziness, nausea, tiredness. These symptoms except tiredness subsided after three weeks. Changed time of taking the medication by 1 hour (from 8am and 8pm to 9am and 9pm) and tiredness was resolved. Perhaps this has something to do with circadian rythms. So far, I am very pleased with this medication. ",4, ,"Nausea ,  vomiting ,  dizziness , drowsiness,  constipation ,  dry mouth , or unsteadiness may occur.",1
355031,35-44,Epileptic Seizure,9/7/2011,carbamazepine,1493,4,1,"I have used that medication for more than 20 years,not any improvement has not happend yet!Now I take two different medicines,combined together,carbamazepine+topiramate(topamax)Really,I'm very upset,further more for treatment unprofessional of our physician here in Tirana(Albania)They combined kind of medicines,without see descriptions in leaflets,couse they don't have capacity to know one other foreing language!I discovered long time ago as combinatin of topamax+carbamazepin can created some side-effects!But they continued to undervalue that!I nedd your help plesa to consult by yout medical in my e-mail adress http:www.eltonrama007tr@gmail.com             With respect Elton Rama,Tirana(Albania)",3,Male,"Nausea ,  vomiting ,  dizziness , drowsiness,  constipation ,  dry mouth , or unsteadiness may occur.",0
355038,25-34,Multiple Seizure Types,9/6/2011,carbamazepine,1493,3,1,Don't feel like myself.,1,Male,"Nausea ,  vomiting ,  dizziness , drowsiness,  constipation ,  dry mouth , or unsteadiness may occur.",0
355046,75 or over,Facial Nerve Pain,8/28/2011,carbamazepine,1493,1,5,Causes extreme dizziness,2,Female,"Nausea ,  vomiting ,  dizziness , drowsiness,  constipation ,  dry mouth , or unsteadiness may occur.",2
355047,35-44,Nerve Pain,7/28/2011,carbamazepine,1493,4,4,"(Chewable version) Taken for nerve/muscle pain in face.  Stopped pain but made me extremely drowsy and unable to concentrate (and do my job), plus gave me rash around my mouth.  Changed meds to stop the side effects.  Did not work very well for me; would avoid taking it again if possible.",1,Male,"Nausea ,  vomiting ,  dizziness , drowsiness,  constipation ,  dry mouth , or unsteadiness may occur.",0
355054,19-24,Other,7/17/2011,carbamazepine,1493,4,5,"I have been satisfied with this drug in use for m Dystonia. But I find now that being on the medication for over 5 years, i am beginning to experience several side effects",1,Female,"Nausea ,  vomiting ,  dizziness , drowsiness,  constipation ,  dry mouth , or unsteadiness may occur.",1
355063,45-54,Epileptic Seizure,6/20/2011,carbamazepine,1493,5,5,"I have taken a few medications. Among what i have taken, this has been the most affective",5,Female,"Nausea ,  vomiting ,  dizziness , drowsiness,  constipation ,  dry mouth , or unsteadiness may occur.",0
355064,55-64,Facial Nerve Pain,6/1/2011,carbamazepine,1493,2,1, ,1,Male,"Nausea ,  vomiting ,  dizziness , drowsiness,  constipation ,  dry mouth , or unsteadiness may occur.",0
355071,55-64,Bipolar Disorder in Remission,5/25/2011,carbamazepine,1493,4,4,Can't say that I have any face pain. Was tired in the beginning but not now. Am taking 600mg once a day,3,Female,"Nausea ,  vomiting ,  dizziness , drowsiness,  constipation ,  dry mouth , or unsteadiness may occur.",3
355080,45-54,Prevention of Seizures following Head Injury or Surgery,5/7/2011,carbamazepine,1493,5,5,"I was having Gran mall Seisures once every three months while on Carbatrol capsules-taking 3 capsules in the morning & 4 capsules in the evening.Now-on CARBAMAZEPINE Tablets EXTENDED RELEASE,I haven't had a seisure in 6 months AND I ONLY TAKE I TABLET IN THE MORNING AND 1 TABLET IN THE EVENING !!!!! ",5,Female,"Nausea ,  vomiting ,  dizziness , drowsiness,  constipation ,  dry mouth , or unsteadiness may occur.",0
355090,35-44,Epileptic Seizure,4/12/2011,carbamazepine,1493,5,3, ,4,Male,"Nausea ,  vomiting ,  dizziness , drowsiness,  constipation ,  dry mouth , or unsteadiness may occur.",0
355091,55-64,Facial Nerve Pain,4/2/2011,carbamazepine,1493,5,4,When I started using this medicine my teeth even hurt and I wanted to pull them out.  And my face hurt so bad that I wanted to eat a bottle of pain pills but I got these pills and am doing better. ,4,Female,"Nausea ,  vomiting ,  dizziness , drowsiness,  constipation ,  dry mouth , or unsteadiness may occur.",3
355098,35-44,Bipolar I Disorder with Most Recent Episode Mixed,3/29/2011,carbamazepine,1493,4,3, ,1,Male,"Nausea ,  vomiting ,  dizziness , drowsiness,  constipation ,  dry mouth , or unsteadiness may occur.",0
355099,25-34,Bipolar I Disorder with Most Recent Episode Mixed,2/27/2011,carbamazepine,1493,3,3,Severe nerve pain in legs and the bi-polar has calmed down but not enough to be satisified with the drug unsure if this is the right choice for me unable to sleep at times. Also used in conjunction with hydrozine temper is still there and black outs at times to.  Hypo mania is also present with this drug alot of times.  Can flip from calm to angry in a short span of time just my review on how it affects me.  Also shakes are very common since starting medication.,2,Male,"Nausea ,  vomiting ,  dizziness , drowsiness,  constipation ,  dry mouth , or unsteadiness may occur.",3
355108,55-64,Epileptic Seizure,2/6/2011,carbamazepine,1493,4,3,"I am not sure if the generic is causing me to have loss of balance, tunnel vision, my legs to go totaly limp and some other simptoms for 2-3 days once every 5-6 weeks.  This did not every happen when I was on the brand name.  As I said I am not sure it is the generic, but my sister (also epileptic) had the same problem.  She fixed it by switching back to the name brand.  My problem started a little after I started the generic.  I had been on the name brand for 15-20 years before.  Can't tell, the body gets older also.  I seem to have a loss of memory also ... not sure about that ...   ",3,Male,"Nausea ,  vomiting ,  dizziness , drowsiness,  constipation ,  dry mouth , or unsteadiness may occur.",1
355109,25-34,Facial Nerve Pain,1/25/2011,carbamazepine,1493,5,4,"Holy Moly, I was sitting on the couch just before XMas & BAM! I was hit with the worst pain in my life. Mine occurs at the top of the cheek, below the eye. It took me a week to finally go to ER cuz I just thought it'd go away & was saddened to find out about this ""disorder"". So little knowledge...I was prescribed Tegretol/Carbamazepine started out 1(200mg) 2x/day, then changed to 2 2x/, also at this change Gabapentin/Neurontin was added 1st 1(300mg) 2x/day, then 2x/day. It's now been 5 weeks & I'm only just now finally starting to see/feel the change happening. I do take pain meds as needed, which is slowly declining. But my concern is how long I'll need to take the meds as I'm a young female looking to get pregnant w/in 2 yrs & these meds are frowned upon during pregnancy. I hope they find out more info on this agonizing pain!",3,Female,"Nausea ,  vomiting ,  dizziness , drowsiness,  constipation ,  dry mouth , or unsteadiness may occur.",10
355116,45-54,Facial Nerve Pain,1/15/2011,carbamazepine,1493,3,4,"I take this for TN.  I started on a low dose and was pain free.  Doctor tried weaning me off and after 3 days had pain again.  About 3 weeks ago had intense pain and doc increased to 1200 per day and tramadol. Pain under control, but I am tired all day and feel like my brain short circuits.  I've never been ditzy til now. Often forget words while talking. Constantly yawning.  Was able to stop tramadol, but am afraid to reduce the other, so for now I pretty much work, eat and sleep and that's about it!",4,Female,"Nausea ,  vomiting ,  dizziness , drowsiness,  constipation ,  dry mouth , or unsteadiness may occur.",15
355124,25-34,Bipolar I Disorder with Most Recent Episode Mixed,1/6/2011,carbamazepine,1493,5,4, ,4,Female,"Nausea ,  vomiting ,  dizziness , drowsiness,  constipation ,  dry mouth , or unsteadiness may occur.",0
355130,45-54,Facial Nerve Pain,1/6/2011,carbamazepine,1493,4,4,I was started on this medication following facial shingles which left me with TN.  I developed a shingles outbreak while undergoing treatment for leukemia.  I found the drug to be much more effective than neurotin with occasional TN episodes.  After about a year I began having more episodes with an increase in pain with each episode.  My physician increased my does from 200 am 400pm to 400 twice a day.  I found myself depressed wanting to sleep 12-14 hours day and chronic dull headaches.  I am going back to my original dose and hoping for the best.  To all you TN suffers out there I pray a drug will be developed soon to releive us of our pain without all the side effects.  My physican couldn't put me on carbamazipine until I finished all my chemotherapy but it has definately been the best drug so far (except narcotics) in controlling the pain.,3,Female,"Nausea ,  vomiting ,  dizziness , drowsiness,  constipation ,  dry mouth , or unsteadiness may occur.",8
355137,45-54,Bipolar I Disorder with Most Recent Episode Mixed,12/31/2010,carbamazepine,1493,5,1,I am a bit more calmer but overall i don't see a big change. Maybe to soon yet. It has been almost 3 months.,2,Female,"Nausea ,  vomiting ,  dizziness , drowsiness,  constipation ,  dry mouth , or unsteadiness may occur.",0
355145,55-64,Epileptic Seizure,12/20/2010,carbamazepine,1493,5,5,"No seizures in 20 years @ 200 mg twice a day, but it decreases my intelligence and learning ability. Easily earned a commercial pilots license before using the drug, but now find call center work taxing. Learned 7 languages before, including Russian, Japanese, & Hebrew; now can't seem to learn Spanish. IQ was about 140, now about 100. Mental processes seem about 1/3 previous speed. On listening to recordings, my speech seems decidedly slow, even when I was trying to talk fast.  These problems were slightly alleviated while I was taking Simvastatin 20 mg/day. Only 2 incidents of obvious dosage problems (not user related) & 1 of those was outside the US. Stupidity is hard to take after being borderline genius, but it's better than seizures.",4,Male,"Nausea ,  vomiting ,  dizziness , drowsiness,  constipation ,  dry mouth , or unsteadiness may occur.",4
355151,45-54,Facial Nerve Pain,12/10/2010,carbamazepine,1493,5,3,"I have been taking the meds for a month.  200 mg split in half twice a day.  I felt better at first, but then the DR upped the dose and I got lots of the listed side effects including hair loss.  I am ashamed to admit it, but I was almost more upset about the hair loss than the jaw pain!   So, I am taking 200mg split in half again and ALEVE.  Honestly the less I think about it the better I feel.  But I went on this site when I was first prescribed the medication and felt obligated to share as everyone else has.  Thank you.",3,Female,"Nausea ,  vomiting ,  dizziness , drowsiness,  constipation ,  dry mouth , or unsteadiness may occur.",12
355161,45-54,Facial Nerve Pain,12/4/2010,carbamazepine,1493,5,5, ,5,Male,"Nausea ,  vomiting ,  dizziness , drowsiness,  constipation ,  dry mouth , or unsteadiness may occur.",3
355169,55-64,Bipolar I Disorder with Most Recent Episode Mixed,11/26/2010,carbamazepine,1493,5,1, ,1,Female,"Nausea ,  vomiting ,  dizziness , drowsiness,  constipation ,  dry mouth , or unsteadiness may occur.",0
355176, ,Facial Nerve Pain,11/1/2010,carbamazepine,1493,4,4,bad bilateral facial pain.  Tegretol and tramadol have worked wonders.,4, ,"Nausea ,  vomiting ,  dizziness , drowsiness,  constipation ,  dry mouth , or unsteadiness may occur.",6
355177,55-64,Nerve Pain,10/11/2010,carbamazepine,1493,5,4,"This medication has helped with my pain from my Diabetic neuropathy in my lower legs.  In a matter of 1 day of taking this drug, the pain became bearable.  Within 2 days the pain is almost gone.  I was taking Lyrica but it is not yet generic.  Carbamazepine is generic.  I'm on a fixed income so this medication is very helpful for me",4,Male,"Nausea ,  vomiting ,  dizziness , drowsiness,  constipation ,  dry mouth , or unsteadiness may occur.",2
355185,25-34,Convulsive Seizures,10/5/2010,carbamazepine,1493,2,3,"THis med is stranly taken me out of self, i cant go to the bathroom i feel sooo tired and i have dry mouth and confusion like crazy",2,Female,"Nausea ,  vomiting ,  dizziness , drowsiness,  constipation ,  dry mouth , or unsteadiness may occur.",0
355193,35-44,Epileptic Seizure,5/17/2010,carbamazepine,1493,3,3,"i m taking it from more than 3 years, but my headache never goes.",3,Female,"Nausea ,  vomiting ,  dizziness , drowsiness,  constipation ,  dry mouth , or unsteadiness may occur.",1
355194,45-54,Bipolar I Disorder with Most Recent Episode Mixed,3/29/2010,carbamazepine,1493,4,4, ,4,Male,"Nausea ,  vomiting ,  dizziness , drowsiness,  constipation ,  dry mouth , or unsteadiness may occur.",0
355202,55-64,Convulsive Seizures,3/18/2010,carbamazepine,1493,5,5,I've been on this medication for 16 years and have been totally seizure free.,5,Female,"Nausea ,  vomiting ,  dizziness , drowsiness,  constipation ,  dry mouth , or unsteadiness may occur.",1
355213,45-54,Facial Nerve Pain,2/17/2010,carbamazepine,1493,3,4,"Since starting this medication I have a difficult time remembering things, especially when I am suppose to take the medicine.  I also have an issue with fake heaving and mucus build up.",4,Female,"Nausea ,  vomiting ,  dizziness , drowsiness,  constipation ,  dry mouth , or unsteadiness may occur.",13
355221,25-34,Bipolar I Disorder with Most Recent Episode Mixed,2/11/2010,carbamazepine,1493,1,1,This has made me severly hostile and even violent.  My mood on the medication was very dark and thoughts of harming other. I have had horrible violent thoughts.  I stopped taking this med immediatelty ,1,Female,"Nausea ,  vomiting ,  dizziness , drowsiness,  constipation ,  dry mouth , or unsteadiness may occur.",5
