,Age,Condition,Date,Drug,DrugId,EaseofUse,Effectiveness,Reviews,Satisfaction,Sex,Sides,UsefulCount
354590, ,Facial Nerve Pain,2/29/2020,carbamazepine,1493,5,5,"No Script or health Insurance needed to place and order with 10% discount for all purchased. It was nice to have some from them, I just hit them at. WhatsApp only:+1(775)7735306,
Call/Text:+1(775)7735306,
Wickr or Kik: peterking2014.
Email: peterkings2014@gmail.com.
Message code: (Med16) Discreet Delivery",5, ,"Nausea ,  vomiting ,  dizziness , drowsiness,  constipation ,  dry mouth , or unsteadiness may occur.",14
354599,55-64,Mania associated with Bipolar Disorder,10/19/2019,carbamazepine,1493,5,5,"It levels me out just fine. Occasionally the doctors have to take me up or down as far as dosage. Blood test for levels are a must.
Don't want to be as zombie.",4,Male,"Nausea ,  vomiting ,  dizziness , drowsiness,  constipation ,  dry mouth , or unsteadiness may occur.",0
354609,75 or over,Extreme Discomfort in Calves when Sitting or Lying Down,9/30/2019,carbamazepine,1493,4,4, ,3, ,"Nausea ,  vomiting ,  dizziness , drowsiness,  constipation ,  dry mouth , or unsteadiness may occur.",0
354617,65-74,Facial Nerve Pain,5/15/2019,carbamazepine,1493,4,4,"My Trigeminal Neuralgia started in 1996 as the result of a severe undiscovered infection caused by a corroded silver pin used during a root canal when I was 11 years old.(I am a language teacher and singer, and went through some excruciating days, using ice packs, heat, etc.)  Doctors just kept wanting to give me pain killers and all the dentists I went to, kept telling me they could see nothing wrong.  Meanwhile, the abscess was eating through my jaw bone.  After it was finally big enough to be discovered, about 10 - 12 months,(and x-rays got more precise) and the abscess was taken care of,  it went away for 20 years. I then moved and found a new dentist who did NOT LISTEN to me!  He made a night guard for the wrong area of my mouth and the TGN started again. Had two very severe attacks in 2017 and I have been using  Carbamazepine as needed when I feel twinges.  I have been very lucky.  I want to let you know about an organic essential that was introduced to me in a health/natural store. You roll it on the outside of the area causing the pain and I have found it to be extremely helpful.  It is VERIDITAS by Pranarom and is called: Just Plain Relief.  Yes,  that's  Plain (with an ""l"").  I take two 200 mg grams of Carba... twice a day and if I do get a spasm, I roll this on.  I find it very soothing and considerably helpful.  I certainly hope you find the right combination that will work for you.   ",4, ,"Nausea ,  vomiting ,  dizziness , drowsiness,  constipation ,  dry mouth , or unsteadiness may occur.",6
354626,35-44,Attention Deficit Disorder with Hyperactivity,3/29/2019,carbamazepine,1493,3,3,"BEEN TAKING THIS FOR SEIZURES AND RECENTLY FOR BIPOLAR I. ALSO HAVE ADHD, BUT ON ADDERALL FOR THAT AND THEN KLONOPINS FOR PANIC ATTACKS. CARBAMAZEPHINE HAS WORKED FOR ME FOR MY SEIZURES DUE TO YEARS OF ABUSING OPIODS. I'D HAVE TO AGREE WITH SOME OF THE PPL HERE, ALSO HAVE TROUBLE WITH LEARNING NEW TRADES , DECREASED DRIVE AND SOMETIMES TIREDNESS ,ANTI-SOCIAL, NOT TOO MUCH ON WEIGHT GAIN. THERES PROBABLY FEW MORE, MY APOLOGIES. I'LL TRY TO REPOST THEM HOPING IT'LL HELP AT LEAST 1 PERSON OR MORE. OVERALL AT THE MOMENT THO, FOR MY SEIZURES, I HAVENT SCARED MY GF FOR 2 YRS AND COUPLE MONTHS, MY NATIONALITY IS ASIAN, AGE 38, USUAL ROUTINE ON LIFE, STARTED WITH MARY J. AND THEN DRINKING, SMOKE CIGARETTES FOR 23 YEARS AND STARTED VAPING TO QUIT, NOT SURE IF IM GOIN OFF SUBJECT , BUT BASICALLY EVERYONES DIFFERENT AND THE MEDICATIONS HAVE THEIR UPS AND DOWNS. SO FOR ME, MY SEIZURES WERE THE REASON IM ON THEM AND ID LIKE TO STOP TAKING CARBAMAZEPHINE EVENTUALLY. LOOKING INTO A LITTLE MORE NATURAL REMEDIES? CBD OILS ? LOL.! IM HOPING THO. THE RULES AND REGULATIONS ARENT SET WELL FOR THAT YET HERE , BUT WE DONT LIVE FOR EVER ALSO, SO TRY AND HOPEFULLY THIS CARBAMAZEPHINE WORKS OR DOESNT, FOR WHOEVER , TOOK TIME TO READ THIS. I PRAY YOU FIND A LIL PEACE OF MIND FROM WHAT EVER YOU'VE ENDURED TO GET HERE. WHICHEVR OR WHOEVER YOUR GOD...BLESS",3,Male,"Nausea ,  vomiting ,  dizziness , drowsiness,  constipation ,  dry mouth , or unsteadiness may occur.",1
354632,55-64,Epileptic Seizure,3/18/2019,carbamazepine,1493,5,5,"I have used carbamazepine ER for 30 years and it has worked well except for 2 seizures 14 years ago which I attribute to 'the change.'  I had to increase my doseage to a total of 1100mg/day, split between morning and evening.  I have had some memory loss, but that started just after my first seizure when I was 35 and was told it was brain disintegration (can't think of the right word).  Finding words is sometimes difficult but can't know if it is the medication or the state of my brain after the seizure.  Every 3 weeks or so I have an aura where I can't follow conversation or process information well.  It ends with a headache so I know it is going away.  If often lasts all day and I may wake up with it.  I don't know if that means less control by the medicine or not.  At least I have not had any seizures for 14 years.  The only really BAD thing is that this drug is part of a class of AEDs that cause bone loss.  After all of these years, I have severe osteoporosis and broke my arm after a bad fall.  The surgeon had to pin everything together and said my bones were weaker than he had anticipated.  Considering I may have at least another 20 years to go, I am considering changing to another drug that does not affect bones.  However, all of the reviews I have read on those (lamotrigine, vimpat, topirimate and leviracetam) are very scary.  Taking Fosamax for my bones is not the answer, apparently, since I had been doing that for a number of years.  Anyone with any info on this is very appreciated.  I suggest all long term users to have bone density tests every 2 years - even the men.  ",5, ,"Nausea ,  vomiting ,  dizziness , drowsiness,  constipation ,  dry mouth , or unsteadiness may occur.",2
354637,35-44,Epileptic Seizure,3/4/2019,carbamazepine,1493,1,1,Did not like the medication at all,1,Female,"Nausea ,  vomiting ,  dizziness , drowsiness,  constipation ,  dry mouth , or unsteadiness may occur.",0
354644,65-74,Nerve Pain,1/8/2019,carbamazepine,1493,3,3,"For a year I have been treated for TMJ but I have such intense pain that I would rather die, that my husband made me go to our family doc about it. He said he thinks its Trigeminal Neuralgia, sent me to ENT, who agreed, he sent me for MRI and to Neurologist, who also agrees it Tri Neuralgia. Now on Carbamazepine, which seems to help but only been on it for 3 weeks. Neuro wants to change that to gabapentin, but side effect reviews for that scare me. I haven't had any pain since 1-2-19, so hoping its working. My pain comes whenever, night or day and lasts anywhere from 1/2 hr to 2 hrs. Would rather go thru childbirth with no assistance than this pain. I'm hoping someone finds an effective cure for this because it's ruining my life-afraid to do anything or go anywhere because it starts out of nowhere. Don't want to embarass myself or my husband. So glad he loves me and helps me through the pain, just by holding me and letting me cry on his shoulder til it passes. Sorry but can't help but cry--don't want to but automatically tears come.",3, ,"Nausea ,  vomiting ,  dizziness , drowsiness,  constipation ,  dry mouth , or unsteadiness may occur.",1
354653,65-74,Facial Nerve Pain,12/11/2018,carbamazepine,1493,5,5,Taking 200 m per day...not eliminating pain...I will have to increase dosage.,5, ,"Nausea ,  vomiting ,  dizziness , drowsiness,  constipation ,  dry mouth , or unsteadiness may occur.",4
354657,45-54,Facial Nerve Pain,8/6/2018,carbamazepine,1493,5,5,"Was experiencing 120 volt-like pain stabs for a while which transferred to 2-5 minute attacks. It was like my own body was electrocuting itself. Carbemazepine at 200mg a day did nothing.  It took 400 mg a day to finally get it under control. I am going to a Dentist today in hopes of extracting a tooth that may be pressing on the nerve.  I am not looking forward to the surgery options. All in all, the Carbemazepine did save my sanity for the time I have been on it. I could actually function as a normal human being this last week. God Bless (or whatever higher being you believe in) if this is happening to you. I would not wish this on my worst enemy.  The medication did work wonders though, but, it is not a final solution.",5, ,"Nausea ,  vomiting ,  dizziness , drowsiness,  constipation ,  dry mouth , or unsteadiness may occur.",12
354663,55-64,Facial Nerve Pain,5/16/2018,carbamazepine,1493,5,5,I took this medication 1000 mg for 8 yrs. when I was first diagnosed I had the Macular decompress operation. Didnâ??t work. 8 yrs later had the Gamma Knife because i was having a lot of pain even with the meds. So I took the chance and it worked. I have been pain free for 1 yr and 2 months. The medicine did work gor me. And the highest dosage I took was 1000 msg per day. But like all medicines there are side affects. I was feeling depression and at times suicidial but I never attempted to do anything so drastic. Because the pain of TN has been know to cause that. I never gave up and I hope this helps someone and gives them hope. I will try gamma knife again if the pain comes back. But the meds did work. ,5, ,"Nausea ,  vomiting ,  dizziness , drowsiness,  constipation ,  dry mouth , or unsteadiness may occur.",11
354669,25-34,Facial Nerve Pain,4/26/2018,carbamazepine,1493,2,2,"I am 28yrs old and have had constant face pain for four years. Just recently acquired insurance, and went to the local urgent Care. Doc there tells me go see a neurologist. Neurologist says you have trigeminal neuralgia and gives me 600mg of gabapentin 3 times a day, and 200mg of carbamazepine 3 times a day. The pain gets dulled away, but some days I can feel it leak through the medication and ruin my life. My wife hates those days. I went to an ENT and he says get your septum fixed and it'll help. I get the surgery. The pain is still there. Can anyone out there with trigeminal neuralgia tell me if they have a constant pain all the time like I do? I've had an MRI and a CT scan and they say nothing is wrong, so it must be that nerve. But everyone else seems like their pain comes and goes. Mine is always there. ",2, ,"Nausea ,  vomiting ,  dizziness , drowsiness,  constipation ,  dry mouth , or unsteadiness may occur.",5
354675,45-54,Nerve Pain of Tongue and Throat from 9th Cranial Nerve,11/18/2017,carbamazepine,1493,4,4,I have been diagnosed with glossopharyngeal Neuralgia (similar to TN) with pain on the left side of my face behind my left ear and down through my throat. I had it several years ago and it was just intermittent with no treatment and then it came back 7 months ago and was incredibly painful. Saw a neurologist who started me on 100mg 2x/day and gradually I have increased to 600 mg 2x/day. Each increase in dosage worked for a week so I am keeping my fingers crossed this dosage will work. still feel pain behind my throat  but nothing compared to what I felt before so I am good with it. Have had the loss of words and feeling a bit foggy feeling that others report but trade off feels worth it at the moment. Just praying it continues to be effective.,4, ,"Nausea ,  vomiting ,  dizziness , drowsiness,  constipation ,  dry mouth , or unsteadiness may occur.",0
354676,45-54,Facial Nerve Pain,10/6/2017,carbamazepine,1493,4,4,"I have been suffering from Trigeminal Neuralgia for the past 2 months and started on 100mg 2x per day.  It practically took away the pain and have recently had to increase to 200mg 2x a day, we will see how that goes.  Side effects are minimal compared to the pain from the TN episodes.  Hoping to control this with just medication and no surgeries. ",4, ,"Nausea ,  vomiting ,  dizziness , drowsiness,  constipation ,  dry mouth , or unsteadiness may occur.",14
354684,55-64,Nerve Pain,10/17/2016,carbamazepine,1493,3,3,"I have been taking this medication for facial nerve pain, for just over a week.  I was on the meds for 3 days and got the pain no relief from the medication. At midnight I took another half to see if it would do anything, at least make me sleepy, but it didn't.   I can feel the pain wanting to come today my 9th day on it and it feels subdued.  Like I know it's there but it's not made it's full arrival  yet.  One very good side effect I've had is this medication has helped me with my depression.  I used to cry everyday and since I started taking this medication I've stopped and not felt so despondent.  As for physical side effects I've had some drowsiness which seems to be going away and if I bend and stand quickly I get dizzy, but that's all.  ",3, ,"Nausea ,  vomiting ,  dizziness , drowsiness,  constipation ,  dry mouth , or unsteadiness may occur.",1
354691,55-64,Facial Nerve Pain,1/20/2016,carbamazepine,1493,5,5,I took this medication for 12 years It was a life saver the pain was intense. Three yrs ago I had Gamma surgery and they clipped the nerve but I still have some pain but only take neutotin 2 per day and 1 carbamazephine. Could not have made it without it.,5,Female,"Nausea ,  vomiting ,  dizziness , drowsiness,  constipation ,  dry mouth , or unsteadiness may occur.",10
354698,35-44,Facial Nerve Pain,1/13/2016,carbamazepine,1493,4,4,I was in extreme pain with trigeminal neuralgia for several months. After taking carbamazepine the pain stopped within 24 hours. I was pain free for about a month. The pain slowly but steadily returned. It is now at a manageable/livable level while taking 400mg per day and has remained that way for 2-3 months now. I have had very little if any side effects. Some loss of words and lowered energy level. ,5, ,"Nausea ,  vomiting ,  dizziness , drowsiness,  constipation ,  dry mouth , or unsteadiness may occur.",12
354699,65-74,Facial Nerve Pain,1/6/2016,carbamazepine,1493,5,5,"Having to take 1400 mg a day to prevent the pain for Trigeminal Neuralgia. It does present some side effects but anything is better than the intense pain I have w/out it. I'm having problems with my eyesight, balance problems and no energy. Am concerned with the size of the dose and will be a user for life. Anyone know the damage to the liver or other statistics? ",4,Male,"Nausea ,  vomiting ,  dizziness , drowsiness,  constipation ,  dry mouth , or unsteadiness may occur.",7
354708,55-64,Epileptic Seizure,11/25/2015,carbamazepine,1493,5,5,This medication works for me,4,Female,"Nausea ,  vomiting ,  dizziness , drowsiness,  constipation ,  dry mouth , or unsteadiness may occur.",0
354716,45-54,Mania associated with Bipolar Disorder,10/17/2015,carbamazepine,1493,4,1,"The medicine kept the manic episode at bay; however, the side effects made me unable to continue taking the medicine.  I developed severe headaches during the third week.  Had headaches 3 days continually until I stopped taking it.",1,Female,"Nausea ,  vomiting ,  dizziness , drowsiness,  constipation ,  dry mouth , or unsteadiness may occur.",0
354717,65-74,Facial Nerve Pain,8/29/2015,carbamazepine,1493,5,5,John - taking for TN1 I find it to be a wonder drug; hope it keeps working; I have been taking this pill for six month's now.,5,Male,"Nausea ,  vomiting ,  dizziness , drowsiness,  constipation ,  dry mouth , or unsteadiness may occur.",7
354726,35-44,Bipolar I Disorder with Most Recent Episode Mixed,3/10/2015,carbamazepine,1493,4,4,I take 600mg and all I want to do is sleep I sleep a total of 15 hours a day and when I get up I am still tired. I can't get anything done around the house. I can't even push myself to clean everything just seems like a chore to me...,3,Female,"Nausea ,  vomiting ,  dizziness , drowsiness,  constipation ,  dry mouth , or unsteadiness may occur.",2
354727,45-54,Bipolar Disorder in Remission,9/19/2014,carbamazepine,1493,5,5,"was diagnosed at 17.. put on litihum... hated it, refused it... put on tegretol and have been totally stable sane and able to sleep and have silence in my head for over 20 years... Saved My Life <3",5,Female,"Nausea ,  vomiting ,  dizziness , drowsiness,  constipation ,  dry mouth , or unsteadiness may occur.",3
354738,35-44,Facial Nerve Pain,7/23/2014,carbamazepine,1493,4,1,"Been having type II TN paion for over 5 years. Been taking Tramadol 100mg twice a day and 2-3 vicodin a night. Gabapentin 600mg at night. With decent results. New neurologist gave me 300mg of this crap to take twice a day. OMG the best way I could describe it is like being a depressed zombie. I took it for 17 days. Looking back the only thing I remember is deciding no to take it anymore. It is a horrible medicine that should only be tried as a last resort medicine!! It did nothing for the pain, in fact it might of made it worse! My Dr. never told me its main use is for anticonvulsant & BI-POLAR DISORDER!!! There is a reason why opioids have been around since 3440B.C. Its cause they WORK! ",1,Male,"Nausea ,  vomiting ,  dizziness , drowsiness,  constipation ,  dry mouth , or unsteadiness may occur.",17
354747,45-54,Facial Nerve Pain,6/2/2014,carbamazepine,1493,3,3,"I don't recommend taking this unless you have your white blood cells monitored pre and during taking this.  I happened to hear that this medication causes drops in white blood cell levels so, I went to the doc and sure enough, my level was 2.9 vis 4.0-11.0. I was told to go off it immediately (Have to get off slowly) AND RETEST LEVELS ONE WEEK LATER.  I know you have to monitor risk benefit. For me, I get face pain episodes  approx 2 times per requiring me to take 3-6 imitrex during that time.  So, I would rather not take this drug.  I have heard Lyrica is supposed to be good but I am choosing to stop all. The risks of side effects long term is just not worth it to me. ",2,Female,"Nausea ,  vomiting ,  dizziness , drowsiness,  constipation ,  dry mouth , or unsteadiness may occur.",10
354754,45-54,Bipolar Disorder in Remission,5/29/2014,carbamazepine,1493,4,4,"I have been on carbamazepine for 15 years and find it is a very effective drug for bi polar disorder.  Regular blood test are a must, and I have been  lucky and my levels are fine.  I wonder after being on this RX for this long if the body becomes immune and will eventually stop working...hope not. ",4,Female,"Nausea ,  vomiting ,  dizziness , drowsiness,  constipation ,  dry mouth , or unsteadiness may occur.",3
354760,75 or over,Prevention of Seizures following Head Injury or Surgery,4/12/2014,carbamazepine,1493,5,5,"had not have any seisures at all after benign menangioma surgery in 1995
",5,Female,"Nausea ,  vomiting ,  dizziness , drowsiness,  constipation ,  dry mouth , or unsteadiness may occur.",0
354767,35-44,Convulsive Seizures,3/17/2014,carbamazepine,1493,3,1,"been on generic sence june 2013 200mg 2x a day some how my lab work on friday showed my levels at almost 0 i dont under stand when on real meds not generic i felt great now trouble talking walking my memory balance and much more dont under stand please help me
",1,Female,"Nausea ,  vomiting ,  dizziness , drowsiness,  constipation ,  dry mouth , or unsteadiness may occur.",0
354776,65-74,Facial Nerve Pain,3/14/2014,carbamazepine,1493,4,4,"Husband's been on Carbamazepine for about 15 years along with gabapentin in high doses. 2 weeks ago had bad spell, still in hospital. Half the time he doesn't know where he is, can barely stand and balance himself. This doctor at hospital said his brain and body became toxic from the carbamazepine. I'm hoping and praying he gets back to normal.",3,Female,"Nausea ,  vomiting ,  dizziness , drowsiness,  constipation ,  dry mouth , or unsteadiness may occur.",17
354777,45-54,Facial Nerve Pain,11/23/2013,carbamazepine,1493,1,5,"Since I started this my TN pain is gone, but I CAN'T BREATHE. My chest is tight all the time. My heart pounds. I had a bad rash for the first couple months which has slowly cleared but the sun brings it back. I have lupus which my idiot doctor knows. Apparently he doesn't know you aren't supposed to take this stuff if you have lupus. I can't wait to get off it.",1,Female,"Nausea ,  vomiting ,  dizziness , drowsiness,  constipation ,  dry mouth , or unsteadiness may occur.",10
354785,45-54,Nerve Pain,10/2/2013,carbamazepine,1493,5,3,"I was recently placed on this drug because my face pain became so severe I could barely eat or talk without intense spells of pain. I could not stand a simple hug without pain. I showed my primary care physician how intense the pain was from the right side of my face to my right shoulder and down my right arm. (I didn't swing on him this time.) After a consul with my neurologist I was placed on this drug. So, far there are no side effects. I have talked to my neurologist about increase in the dosage during extreme pain to two pills. Having TIC isn't fun but I'm learning to enjoy certain parts of life; I thought would be lost to me because of this condition. This is now the three drug I've been on because of TIC; I pray there is a surgical solution that may help all of us. I know the pain of washing my face and screaming because one drug didn't work. I know the pain of eating so slowly others worry and wonder about your health. I know the pain of being examine by your doctor and nearly putting him on the floor because he found the source of your pain, twice. I know pain the same doctor felt want he has tried everything he knows to help you and your working with him 100% to put the pain your enduring into your short-term memory. I know the pain of tensing went your hugged by friends and family, because the pain will shot through your face, neck and shoulder like a white hot knife. I would like to feel like I did over five years ago. When dancing Argentine Tango was a simple walk, okay not so simple but a dance I enjoyed. Not, my choosing open embrace because of the pain I have to avoid.                  I will enjoy my life despite TIC and I will fight back. This is my body and I pay the rent; TIC will not kick me out and move in.    ",3,Female,"Nausea ,  vomiting ,  dizziness , drowsiness,  constipation ,  dry mouth , or unsteadiness may occur.",0
354792,65-74,Facial Nerve Pain,8/29/2013,carbamazepine,1493,5,5,eliminates pain for long periods of time. Occasionally need to increase the dose when having pain after unusual stimulation as after dental work. I have been able to decrease the dose after a few days on the higher dose.,5,Female,"Nausea ,  vomiting ,  dizziness , drowsiness,  constipation ,  dry mouth , or unsteadiness may occur.",16
354800,55-64,Multiple Seizure Types,6/17/2013,carbamazepine,1493,3,1,I have been a migraine sufferer for over 30 years.  I finally went to a neurologist who after an EEG diagnosed a seizure disorder. I was taking 100 mg chewable twice daily but doulc NOT function at work because it made me so tired.  So I had to stop it.,1,Female,"Nausea ,  vomiting ,  dizziness , drowsiness,  constipation ,  dry mouth , or unsteadiness may occur.",0
354811,45-54,Epileptic Seizure,5/17/2013,carbamazepine,1493,3,1,I wouldn't recommend taking this med unless absolutely necessary. I made me very antisocial and depressed. I also gained about 50 lbs while taking it over 2 yrs.,1,Male,"Nausea ,  vomiting ,  dizziness , drowsiness,  constipation ,  dry mouth , or unsteadiness may occur.",1
354825,65-74,Facial Nerve Pain,5/12/2013,carbamazepine,1493,4,5,i have trigemenial neuralgia across my forehead and down the side of my face.  it took a while for the initial side affects to pass.  since then the relief has been wonderful.  my only regret is this seems to be a medication i will need to take for life.,4,Male,"Nausea ,  vomiting ,  dizziness , drowsiness,  constipation ,  dry mouth , or unsteadiness may occur.",17
354840,35-44,Bipolar I Disorder with Most Recent Episode Mixed,5/6/2013,carbamazepine,1493,5,5,other Bipolar drugs made me a zombie..carbinzine doesn't,5,Female,"Nausea ,  vomiting ,  dizziness , drowsiness,  constipation ,  dry mouth , or unsteadiness may occur.",4
354855,35-44,Facial Nerve Pain,3/21/2013,carbamazepine,1493,5,5,"I was hit with an outbreak of shingles, on cranial nerve 5...which has caused Trigeminal Neuralgia (TN).  The pain was truly intense, only on the right side...I could not touch my scalp (shower water was horribly painful), my right ear had shooting pain into my jaw, right side of my face was numb and slack, and looked like I had a black eye. My gums & teeth on right side hurt, spices (even mustard on my hotdog) hurt!! I truly feared I had a tumor!!  Dr. prescribed Tegretol 100mg 2x day for two days, then increase to 200mg 2x for 2 days...working my way up to 400mg 2x.  On the 3rd day of the meds, I attempted to increase to the 200mg...and it was way too much.  Pain creeps in at the 100mg dose, so we are supplementing with a liquid and increasing it slowly as needed...seems to be working.  I do feel like I'm in a fog, have trouble thinking of words, speaking coherently, making sentences...I fall. I am depressed.  But the meds are helping with the pain...they work well...I just don't like the side effects...I even have to get someone to help my kids with their homework, as I just can't wrap my brain around it, which makes me feel worthless, which adds to the depression.  Have gained weight, which adds to depression. Very tired. Hoping it will only be a 6 month course of meds, hoping no more shingles.",3,Female,"Nausea ,  vomiting ,  dizziness , drowsiness,  constipation ,  dry mouth , or unsteadiness may occur.",10
