,Age,Condition,Date,Drug,DrugId,EaseofUse,Effectiveness,Reviews,Satisfaction,Sex,Sides,UsefulCount
355222,7-12,Prevention of Seizures following Head Injury or Surgery,1/12/2010,carbamazepine,1493,4,5,"My 7 year old boy had his first siezure 9 months ago. We are still learning about this condition and have had more insight reading reviews. I have more questions to ask our doctor and have learned a lot more from WebMD. He has had siezures occur even if he missed one dose, and also figured out that if he doesn't get enough rest, siezures will occur at school. He had his first siezure while walking last week (at school)and ended up with a bloody nose and fat lip from the fall. We may need to up his dose during his check up this month. A doctor believes the siezures are caused by an injury to the brain but there was no injury that we know of that happened to him. The medication works wonders and he has no side effects other than a stomach ache once in a while. Does anyone know of any support group sites with live chat?",3,Male,"Nausea ,  vomiting ,  dizziness , drowsiness,  constipation ,  dry mouth , or unsteadiness may occur.",1
355230,35-44,Nerve Pain,12/28/2009,carbamazepine,1493,5,4,"The only drawback is that I have to get my blood taken to check the level. It seems to have worked when Gabapentin petered out on me, which happens from time to time.",4,Female,"Nausea ,  vomiting ,  dizziness , drowsiness,  constipation ,  dry mouth , or unsteadiness may occur.",1
355238,45-54,Manic-Depression,12/27/2009,carbamazepine,1493,4,5,"Prior to taking this med daily functioning was limited to manic episodes then difficult depressions that I couldn't seem to get past. This med has been a life saver. I ""feel"" GREAT...no highs or bottom lows. I ""feel"" normal/level. No ups or downs. I'm loving life and enjoy living and laughing :O)",5,Female,"Nausea ,  vomiting ,  dizziness , drowsiness,  constipation ,  dry mouth , or unsteadiness may occur.",6
355248,35-44,Epileptic Seizure,12/23/2009,carbamazepine,1493,5,5, ,5,Female,"Nausea ,  vomiting ,  dizziness , drowsiness,  constipation ,  dry mouth , or unsteadiness may occur.",0
355258,45-54,Facial Nerve Pain,12/23/2009,carbamazepine,1493,4,4,"I take this medication in conjunction with Neurontin for Trigeminal Neuralgia (sharp, stabbing electric like pain in my face that will stop me in my tracks when it hits).  I have had this condition since 1997 and after trying many combinations of medications, this drug and Neurontin together have been wonderful.  ",4,Female,"Nausea ,  vomiting ,  dizziness , drowsiness,  constipation ,  dry mouth , or unsteadiness may occur.",11
355267,35-44,Facial Nerve Pain,12/15/2009,carbamazepine,1493,4,4,"At first I was very dizzy and fatigued,now I am just fatigued and only sometimes get dizzy.But somewhat effective for my pain.",4,Female,"Nausea ,  vomiting ,  dizziness , drowsiness,  constipation ,  dry mouth , or unsteadiness may occur.",4
355275,45-54,Prevention of Seizures following Head Injury or Surgery,12/5/2009,carbamazepine,1493,1,3,Its been quite a few years ago but I insidiously developed chemical hepatitis w/ liver enzymes becoming very elevated & pain in upper right quadrant of abdomen. In addition I had a severe headache w/ temperature of 103 degrees (F). It was diagnosed as chemical meningitis. Very sick and was in hospital for 9 days waiting for diagnosis. Never been so sick...,1,Female,"Nausea ,  vomiting ,  dizziness , drowsiness,  constipation ,  dry mouth , or unsteadiness may occur.",0
355282,25-34,Facial Nerve Pain,11/5/2009,carbamazepine,1493,5,5, ,5,Female,"Nausea ,  vomiting ,  dizziness , drowsiness,  constipation ,  dry mouth , or unsteadiness may occur.",5
355283,35-44,Epileptic Seizure,11/3/2009,carbamazepine,1493,4,3,800 mil a day but ive siezed 4 times recently,3,Male,"Nausea ,  vomiting ,  dizziness , drowsiness,  constipation ,  dry mouth , or unsteadiness may occur.",0
355293,25-34,Bipolar I Disorder with Most Recent Episode Mixed,10/12/2009,carbamazepine,1493,3,3,"I'm taking this to supplement my lithium, and I wish I could just take more lithium. Why do the cheapest drugs have to have the most side effects? I'm studying a new language, and taking lots of classes, and often I'm too confused to pay attention, and when I'm not confused I'm falling asleep. But maybe the drugs are helping... or maybe I just haven't had another episode yet. ",1,Male,"Nausea ,  vomiting ,  dizziness , drowsiness,  constipation ,  dry mouth , or unsteadiness may occur.",4
355303,35-44,Prevention of Seizures following Head Injury or Surgery,10/10/2009,carbamazepine,1493,3,1,I have several bad reations to this medications and would not recommend it to anyone.,1,Female,"Nausea ,  vomiting ,  dizziness , drowsiness,  constipation ,  dry mouth , or unsteadiness may occur.",0
355304,19-24,Bipolar Disorder in Remission,9/13/2009,carbamazepine,1493,4,4,I have been on everything for my bipolar and this is the only drug that works for me!! I LOVE IT!!,4,Female,"Nausea ,  vomiting ,  dizziness , drowsiness,  constipation ,  dry mouth , or unsteadiness may occur.",6
355312,45-54,Extreme Discomfort in Calves when Sitting or Lying Down,8/28/2009,carbamazepine,1493,5,4, ,4,Female,"Nausea ,  vomiting ,  dizziness , drowsiness,  constipation ,  dry mouth , or unsteadiness may occur.",0
355320,45-54,Facial Nerve Pain,8/17/2009,carbamazepine,1493,4,1,"I was referred to an ear, nose & throat specialist because of recurrent - though sporadic - bouts of facial nerve pain (specifically in the upper left sinus/cheekbone area & behind and under the left eye). The pain would usually occur during sleep when the discomfort would be strong enough to wake me up. I've had some relief with Advil, but the pain was so unusual and localized, I was sure I should be checked out. Had not had a bout of it in about two weeks when I went to the ENT.    

Last week, after taking just one(my first)dose of Carbamazepine,I experienced a very bad recurrence in the middle of the night.  Dr. wants me on 200 mg. once a day, but now I'm afraid to take it again! ",1,Female,"Nausea ,  vomiting ,  dizziness , drowsiness,  constipation ,  dry mouth , or unsteadiness may occur.",7
355329,55-64,Facial Nerve Pain,8/14/2009,carbamazepine,1493,5,5,Only carbamezapine...NOT eridol,5,Female,"Nausea ,  vomiting ,  dizziness , drowsiness,  constipation ,  dry mouth , or unsteadiness may occur.",4
355330,19-24,Prevention of Seizures following Head Injury or Surgery,6/17/2009,carbamazepine,1493,5,3,"I've been on this drug for about 17 years. It was completely effective until I was 17 at which time i started to suffer from seizures again. I increased the dosage which made me burnt out, then started another drug, lamotrigine, which has been good, but I've still have partial and a couple grand mal seizures over the last 5 years. Now I'm noticing what appear to be side effects from the list on here. Random pain, and most importantly erectal dysfunction.  ",4,Male,"Nausea ,  vomiting ,  dizziness , drowsiness,  constipation ,  dry mouth , or unsteadiness may occur.",0
355338,35-44,Facial Nerve Pain,6/12/2009,carbamazepine,1493,5,3,"Diagnosed with TN at 30 it has been an interesting journey.  It took about 3-5 months to get the right combination of drugs, carbamazapine and sertraline.  Finally the pain subsided and became more of a dull ache than the stabbing spasms of electric shocks.  My dose became so high (600mg daily) just to control the pain.  It was worth it.  Then after about 2-3 years it stopped working.  I couldn't take any higher dose so switched to neurontin for 6 months.  Not as effective.  Tried accupuncture, seemed to help for quite a while, a year or more I'd say.  Then almost like magic symptoms went away.  I would catch a pain on occasion but nothing but a reminder of what it was.  Now, 13 years later, it is back with a vengeance and I am debating about returning the the drug.  I am not looking forward to that foggy, tired and weak feeling but anything is better than TN pain.  If you can tough out the weakness and find the right therapeutic dose, it worked for me.  I am counting on it working again.",3,Female,"Nausea ,  vomiting ,  dizziness , drowsiness,  constipation ,  dry mouth , or unsteadiness may occur.",10
355347,65-74,Facial Nerve Pain,6/11/2009,carbamazepine,1493,5,5,I have experienced weakness in my legs and tingling sensations in my feet and thighs. I wonder if the medication could cause this,5,Female,"Nausea ,  vomiting ,  dizziness , drowsiness,  constipation ,  dry mouth , or unsteadiness may occur.",6
355348,25-34,Multiple Seizure Types,6/9/2009,carbamazepine,1493,5,5,my 7yrs old son have been taken to drug for his seizure problem it has been effective from the very start,5,Male,"Nausea ,  vomiting ,  dizziness , drowsiness,  constipation ,  dry mouth , or unsteadiness may occur.",1
355361,25-34,Bipolar I Disorder with Most Recent Episode Mixed,6/7/2009,carbamazepine,1493,5,3,"I have only been on this drug for about a week, but I am having episodes of ""spacing out"", almost like I'm drunk.  Does that feeling go away, or is this going to continue?  Has anyone else had these same symptoms and if so how long did they last?",2,Female,"Nausea ,  vomiting ,  dizziness , drowsiness,  constipation ,  dry mouth , or unsteadiness may occur.",4
355372,35-44,Other,6/6/2009,carbamazepine,1493,5,3,"This was administered in the treatment of shingles. It has somewhat quited the pain from the shingles, but the pain is still persistent, and sometimes flares, giving shooting pain in the affected area.",3,Male,"Nausea ,  vomiting ,  dizziness , drowsiness,  constipation ,  dry mouth , or unsteadiness may occur.",2
355383,55-64,Convulsive Seizures,5/28/2009,carbamazepine,1493,5,5, ,5,Female,"Nausea ,  vomiting ,  dizziness , drowsiness,  constipation ,  dry mouth , or unsteadiness may occur.",0
355384, ,Facial Nerve Pain,5/26/2009,carbamazepine,1493,4,4,"Taking this for TN. Also have MS.  Med works for the TN but makes me so weak I cannot transfer from my wheelchair to the toilet & back.  Must have assistance.  Lose all strength in both my legs and arms.  

Have backed off on dosage to try and gain some strength back, but can only go about 24 hrs without taking another 'poison pill' (as I call them) because the TN becomes excruciating.  (It really is the 'suicide disease' because you just want to be put out of your misery.)  

If the drug didn't make me so weak, it would be a godsend, but now I have to decide which is worse:  the TN or the extreme weakness.",2,Female,"Nausea ,  vomiting ,  dizziness , drowsiness,  constipation ,  dry mouth , or unsteadiness may occur.",4
355394,25-34,Convulsive Seizures,5/4/2009,carbamazepine,1493,3,1,since i have been taking this medicine there's things that i forget and it makes me feek like i am drunk are you supposed to feel this way while on this medicine,2,Female,"Nausea ,  vomiting ,  dizziness , drowsiness,  constipation ,  dry mouth , or unsteadiness may occur.",2
355402,55-64,Epileptic Seizure,3/23/2009,carbamazepine,1493,5,5,I HAVE BEEN TAKEN CARBAMAZEPINE FOR ABOUT 16 YEARS. HAVE NOT HAD A SEIZURE SINCE. HAVE HAD NO PROBLEMS THAT I KNOW OF. ,5,Male,"Nausea ,  vomiting ,  dizziness , drowsiness,  constipation ,  dry mouth , or unsteadiness may occur.",2
355410,25-34,Epileptic Seizure,3/22/2009,carbamazepine,1493,5,4,"Carbamazepime worked very well for me over the years. The only problem was that over the years my neurologist had to increase my dosage every couple of years. My neurologist told me that carbamazepime was a drug that strangely, tends to build up an immunity to itself, so the longer that you take it the less effective it becomes over the years. I don't know how many people in which this effect tends to happen, but if you are having to increase your dosage every so often, it's most likely that the problem is the one I described. I'm now trying other anticonvulsants, but have not yet really found one that works. ",4,Male,"Nausea ,  vomiting ,  dizziness , drowsiness,  constipation ,  dry mouth , or unsteadiness may occur.",3
355419,45-54,Facial Nerve Pain,3/7/2009,carbamazepine,1493,2,2,"I have become dizzy,no help for lower jaw pain. The sensations I have on my face are not painful,just annoying,on my cheeck ,around my eye[left side]and know my forehead.",1,Male,"Nausea ,  vomiting ,  dizziness , drowsiness,  constipation ,  dry mouth , or unsteadiness may occur.",5
355420,45-54,Epileptic Seizure,3/6/2009,carbamazepine,1493,5,5, ,4,Female,"Nausea ,  vomiting ,  dizziness , drowsiness,  constipation ,  dry mouth , or unsteadiness may occur.",1
355429,25-34,Epileptic Seizure,2/27/2009,carbamazepine,1493,5,5,I HAVE BEEN ON MY SEIZURE MEDS FOR ABOUT 5 YEARS NOW IM VERY PLEASED WITH IT.,5,Female,"Nausea ,  vomiting ,  dizziness , drowsiness,  constipation ,  dry mouth , or unsteadiness may occur.",3
355439,55-64,Nerve Pain,2/13/2009,carbamazepine,1493,3,3, ,3,Female,"Nausea ,  vomiting ,  dizziness , drowsiness,  constipation ,  dry mouth , or unsteadiness may occur.",2
355440,65-74,Facial Nerve Pain,2/12/2009,carbamazepine,1493,2,1, ,1,Female,"Nausea ,  vomiting ,  dizziness , drowsiness,  constipation ,  dry mouth , or unsteadiness may occur.",1
355451,45-54,Prevention of Seizures following Head Injury or Surgery,12/11/2008,carbamazepine,1493,4,4,"I have been on carbamazepine for many years.  Recently I broke out in an itchy rash from head to toe.  When tested, my level was 14.4!  The highest level should only be 6.2.  I stopped immediately.",1,Female,"Nausea ,  vomiting ,  dizziness , drowsiness,  constipation ,  dry mouth , or unsteadiness may occur.",1
355458,55-64,Prevention of Seizures following Head Injury or Surgery,11/25/2008,carbamazepine,1493,5,4, ,4,Male,"Nausea ,  vomiting ,  dizziness , drowsiness,  constipation ,  dry mouth , or unsteadiness may occur.",1
355468,19-24,Bipolar I Disorder with Most Recent Episode Mixed,11/19/2008,carbamazepine,1493,1,1,This medication has caused me to become severely hostile and extremely easily agitated. Has done nothing but made my condition worse.,1,Female,"Nausea ,  vomiting ,  dizziness , drowsiness,  constipation ,  dry mouth , or unsteadiness may occur.",7
355479,45-54,Facial Nerve Pain,11/16/2008,carbamazepine,1493,5,5,"This has been a wonder drug for me!  I could not live without it - after having burning gums, severe jaw and facial pain for over a year, within 2 days of taking this I felt instantly better.  The only ancillary effect is that I don't have any mood highs or lows - just very even keel.  I guess that can be good in a way...",5,Female,"Nausea ,  vomiting ,  dizziness , drowsiness,  constipation ,  dry mouth , or unsteadiness may occur.",11
355480,75 or over,Nerve Pain,11/16/2008,carbamazepine,1493,4,1, ,1,Female,"Nausea ,  vomiting ,  dizziness , drowsiness,  constipation ,  dry mouth , or unsteadiness may occur.",0
355498,55-64,Facial Nerve Pain,11/11/2008,carbamazepine,1493,5,5,Nerve pain is under control but I am so tired and just feel run down. I slept last night from 7 PM to 7AM and still feel tired.,4,Female,"Nausea ,  vomiting ,  dizziness , drowsiness,  constipation ,  dry mouth , or unsteadiness may occur.",9
355513,55-64,Nerve Pain,10/26/2008,carbamazepine,1493,4,5, ,4,Female,"Nausea ,  vomiting ,  dizziness , drowsiness,  constipation ,  dry mouth , or unsteadiness may occur.",1
355530, ,Facial Nerve Pain,10/20/2008,carbamazepine,1493,5,3,I have relapses.  It's like my body has become immune to how much I'm taking,3, ,"Nausea ,  vomiting ,  dizziness , drowsiness,  constipation ,  dry mouth , or unsteadiness may occur.",7
355552,65-74,Facial Nerve Pain,10/14/2008,carbamazepine,1493,4,4,Have experienced continual diarrhea since being on the medication.,3,Female,"Nausea ,  vomiting ,  dizziness , drowsiness,  constipation ,  dry mouth , or unsteadiness may occur.",4
355572,25-34,Mania associated with Bipolar Disorder,10/12/2008,carbamazepine,1493,4,5,this  has  helped  me,4, ,"Nausea ,  vomiting ,  dizziness , drowsiness,  constipation ,  dry mouth , or unsteadiness may occur.",3
355573,45-54,Facial Nerve Pain,9/23/2008,carbamazepine,1493,1,1,"Side effects, for me, included a threefold increase of the very symptoms it was supposed to qwell with continual recurrences for the duration of that particular dose (200MG Tab)lasting about ten hours with one episode/45min and a lull of about 10-15 min before the next. ""Onsets"" were non-existant. The medication seemed to be elevating and perpetuating existing symptoms. The medication was easy to ingest and Very Hard to tolerate. Hot Water Bottle or Ice Pack in hand, vertually all possible negative side affects were a part of these sessions. Trigeminal Neuralgia has been coined the ""Suicude Disease."" I consider myself ""fortunate"" here in that I characterize my experiences as a 9+ on the threshold and give a credit of 10 (IF that is the absolute max) to Cluster HA's. There is a history of lower limb reconcstructive surgeries to which I might attribute ""some"" number(s) but am at a loss to do so given environmental variables such as frequency and duration, as would be the case with any of the above in association with the other.

With both TN and Cluster HA's it has been my experience during the periodical adventures that doctors are quite willing to provide a script and say ""See me in X weeks."" Quite often it has already been X days or weeks that things have been progressing; On the floor, in tears, and absolutely helpless! If the Doctors writing the scripts had the opportunity to live in the patients shoes for 24 hours they might not be so casual about treating them as guinea pigs and realize some empathy toward what dehumanizing and painful experiences the patient has been goin through. Trial and error meds shouldn't be the first item on the MD's protocol. HEY DOC! This crap hurts - right here - right NOW. Good Luck Folks. ",1,Male,"Nausea ,  vomiting ,  dizziness , drowsiness,  constipation ,  dry mouth , or unsteadiness may occur.",15
355592,55-64,Nerve Pain,9/22/2008,carbamazepine,1493,5,3, ,4,Male,"Nausea ,  vomiting ,  dizziness , drowsiness,  constipation ,  dry mouth , or unsteadiness may occur.",0
355611,55-64,Other,9/7/2008,carbamazepine,1493,5,5,Can you tell me if this medication can cause chronic diarhea?,4,Female,"Nausea ,  vomiting ,  dizziness , drowsiness,  constipation ,  dry mouth , or unsteadiness may occur.",1
355612,45-54,Other,9/5/2008,carbamazepine,1493,1,1,"got this treatment for burning feet but since using this i loss my hair. is this normal. did not stop the burning feet,worse if any.",1,Female,"Nausea ,  vomiting ,  dizziness , drowsiness,  constipation ,  dry mouth , or unsteadiness may occur.",3
355627,55-64,Bipolar I Disorder with Most Recent Episode Mixed,7/27/2008,carbamazepine,1493,5,4,"Very few side effects,snapped me out of a manic episode.",4,Female,"Nausea ,  vomiting ,  dizziness , drowsiness,  constipation ,  dry mouth , or unsteadiness may occur.",6
355641,25-34,Convulsive Seizures,7/7/2008,carbamazepine,1493,5,5,"this is a wondr drug for me!!  i was way out of control, acting out, swearing and cussing and anything or anyone.  maic behaver lasted up to 5 days sometimes with no sleep... now no more racing thoughts, lower anger and thoughts of suicde and depress are gone.  this is one drug i belive in whole hartitly!",5,Male,"Nausea ,  vomiting ,  dizziness , drowsiness,  constipation ,  dry mouth , or unsteadiness may occur.",3
355657,35-44,Attention Deficit Disorder with Hyperactivity,6/21/2008,carbamazepine,1493,2,3, ,1,Female,"Nausea ,  vomiting ,  dizziness , drowsiness,  constipation ,  dry mouth , or unsteadiness may occur.",1
355672,35-44,Other,6/15/2008,carbamazepine,1493,4,3,I'M TAKEN THIS FOR MOOD SWINGIT IS HELPING SOME.,4,Female,"Nausea ,  vomiting ,  dizziness , drowsiness,  constipation ,  dry mouth , or unsteadiness may occur.",1
355685, ,Nerve Pain,5/26/2008,carbamazepine,1493,5,3,it works for about 5 to 6 weeks well. then for about 3days to 10 days it dose not.,4,Male,"Nausea ,  vomiting ,  dizziness , drowsiness,  constipation ,  dry mouth , or unsteadiness may occur.",1
355697,25-34,Mental Disorder with Loss of Normal Personality & Reality,4/22/2008,carbamazepine,1493,5,5,"I know the doc said it would take time to start working but I felt better the first week on this.  I don't have exteme up's and down's and I'm not nearly as moody overall to those around me.  I do not have anger outbursts any longer either.  I DO however have serious issues with sleeping.  I can't get to sleep and when I finally do, I can't maintain sleeping.  I wake up nearly every hour or two.  My doc prescribed this medication for bi-polar disorder and so far it is helping that just not my sleep.  Also, MAKE SURE YOU EAT within 10 minutes of taking this one in the morning or you'll get nausia within that time and be sick.  ",4,Female,"Nausea ,  vomiting ,  dizziness , drowsiness,  constipation ,  dry mouth , or unsteadiness may occur.",13
355706,45-54,Bipolar Disorder in Remission,2/21/2008,carbamazepine,1493,5,3,it seems to help curve some of the ups & downs . more even for longer periods of time,5,Male,"Nausea ,  vomiting ,  dizziness , drowsiness,  constipation ,  dry mouth , or unsteadiness may occur.",5
355715,19-24,Other,2/14/2008,carbamazepine,1493,5,4,"This medication works great as a mood stabilizer; however, it has altered my perception of musical pitch. Everything sounds about one semitone lower than it should. I'm a professional musician and I hope that these effects do not last too long.",3,Male,"Nausea ,  vomiting ,  dizziness , drowsiness,  constipation ,  dry mouth , or unsteadiness may occur.",4
355725,65-74,Nerve Pain,1/31/2008,carbamazepine,1493,3,2, ,2,Male,"Nausea ,  vomiting ,  dizziness , drowsiness,  constipation ,  dry mouth , or unsteadiness may occur.",3
355734,45-54,Facial Nerve Pain,12/13/2007,carbamazepine,1493,5,1, ,1,Male,"Nausea ,  vomiting ,  dizziness , drowsiness,  constipation ,  dry mouth , or unsteadiness may occur.",6
355741,19-24,Other,11/15/2007,carbamazepine,1493,5,5,"My doctor prescibed this medication for my bipolar disorder and its helped alot. AT first i was sceptic and we had to get me to therapuic levels, but it has indeed helped.",5,Female,"Nausea ,  vomiting ,  dizziness , drowsiness,  constipation ,  dry mouth , or unsteadiness may occur.",6
355750,25-34,Epileptic Seizure,11/1/2007,carbamazepine,1493,3,5,"This medication has been the only anti-convulsant that has kept me seizure free. It is a great drug, though it does upset my stomach. I take the pills with food and the irritation subsides. ",5,Female,"Nausea ,  vomiting ,  dizziness , drowsiness,  constipation ,  dry mouth , or unsteadiness may occur.",9
355758,25-34,Epileptic Seizure,10/18/2007,carbamazepine,1493,5,5,To me it the same of any other seizure drug i have taken lucky no side affects that i have seen. ,5,Male,"Nausea ,  vomiting ,  dizziness , drowsiness,  constipation ,  dry mouth , or unsteadiness may occur.",3
355767,19-24,Epileptic Seizure,10/13/2007,carbamazepine,1493,5,4,Been taking this for about 13 years and it does it's job for the most part. Needed to add a second medication since this alone did not control the seizures. The only side effect that remains is drowsiness.,4,Female,"Nausea ,  vomiting ,  dizziness , drowsiness,  constipation ,  dry mouth , or unsteadiness may occur.",8
355768,25-34,Other,9/22/2007,carbamazepine,1493,5,5,"I started using this medication in my early 20's when I had 3 possible seizures.  It has always worked and been easy for me to use. The dose is good.  The one side effect that I DO get is the ""involuntary eye movement.""",5,Female,"Nausea ,  vomiting ,  dizziness , drowsiness,  constipation ,  dry mouth , or unsteadiness may occur.",6
